{
  "schemaVersion": "1.0.0",
  "changeId": "compiled-provider-review-runtime",
  "changeType": "platform_change",
  "title": "Run compiled plugin contracts through provider collection and exhaustive review planning",
  "summary": "Bind a negotiated platform provider for a data-only plugin contract, freeze complete source elements, and plan one review atom for every element, Check, and Dimension.",
  "changedPaths": [
    "src/assayer_platform/compiled_interactive.py",
    "tests/test_compiled_interactive.py",
    "design/changes/compiled-provider-review-runtime.json"
  ],
  "authorityDocuments": [
    "docs/platform-constitution-v2.md",
    "docs/platform-plugin-boundary-contract.md",
    "docs/design-confirmation-contract-v1.md"
  ],
  "ownership": {
    "platform": ["provider selection", "capability negotiation", "source freezing", "element enumeration", "ReviewBatch planning", "coverage ledger"],
    "plugin": ["identity", "Checks", "Dimensions", "semantic requirements"],
    "provider": ["typed source snapshots", "complete source payload"],
    "agent": ["five-state decisions over platform-created atoms"]
  },
  "capabilities": {
    "inputKinds": ["document", "markdown", "browser_snapshot"],
    "required": ["provider_binding", "complete_element_enumeration", "review_batch_planning", "coverage_ledger"]
  },
  "forbiddenResponsibilities": [
    "plugin provider selection",
    "plugin element filtering",
    "plugin-owned ReviewBatch or CoverageLedger",
    "legacy decision states as terminal semantics"
  ],
  "publicContractImpact": "breaking",
  "acceptance": [
    "compiled controller negotiates a provider without PluginRegistration",
    "provider failures become blocked or unknown evidence state and remain traceable",
    "every discovered element is crossed with every Check Dimension",
    "ReviewBatch is Host-planned with deterministic bounded identities",
    "five-state terminal vocabulary is exposed by the compiled path"
  ],
  "humanApproval": {
    "required": true,
    "status": "approved",
    "approver": "user",
    "approvedAt": "2026-09-16T00:00:00+08:00",
    "decision": "Approved by continuing the contract-native provider and review planning work."
  },
  "state": "verified"
}
