{
  "schemaVersion": "1.0.0",
  "changeId": "run-authored-text-check-in-verification-profiles",
  "changeType": "platform_change",
  "title": "Run the authored-text check in the verification profiles",
  "summary": "scripts/check_english_text.py was made honest and green in make-english-text-gate-honest, but nothing invoked it: neither scripts/run_tests.py nor any CI workflow ran it, so the gate could drift back to red unnoticed. This change adds a language preflight to scripts/run_tests.py so both the fast and full profiles reject non-English authored text before running tests. The fast profile is what CI calls, and it also runs locally, so the check is enforced in one place instead of being an optional script.",
  "changedPaths": [
    "scripts/run_tests.py"
  ],
  "authorityDocuments": [
    "docs/platform-constitution-v2.md",
    "docs/ci-support-matrix-v1.md"
  ],
  "ownership": {
    "platform": ["Repository verification tooling owns the language preflight"],
    "plugin": ["No plugin change"],
    "provider": ["No provider change"],
    "agent": ["No agent change"]
  },
  "capabilities": {
    "inputKinds": [],
    "required": []
  },
  "forbiddenResponsibilities": [
    "The preflight must not weaken the English-text allowlist or the report contract",
    "The preflight must not add a new CI job or change the CI matrix",
    "A failing language preflight must not be reported as a test failure"
  ],
  "publicContractImpact": "internal_only",
  "acceptance": [
    "scripts/run_tests.py fast returns 0 on a clean tree",
    "scripts/run_tests.py rejects authored non-English text in a non-allowlisted path with exit code 2",
    "the preflight reuses scripts/check_english_text.py rather than reimplementing the scan",
    "no new workflow job or matrix entry is added"
  ],
  "humanApproval": {
    "required": false,
    "status": "approved",
    "approver": "于旸",
    "approvedAt": "2026-09-17T15:29:01+08:00",
    "decision": "Internal-only follow-up to make-english-text-gate-honest, carried out under the mandate in #assayer-group:4c84ee19 and the review request from @assayer_rev to make the now-honest gate actually run."
  },
  "state": "approved"
}
