{
  "schemaVersion": "1.0.0",
  "changeId": "delete-tests-for-retired-plugin-runtimes",
  "changeType": "platform_change",
  "title": "Delete tests for removed Host and Python plugin runtimes",
  "summary": "Remove historical tests whose subject is a deleted HostCore, browser router, PluginRegistration, wheel package, registration registry, DomainResult, or legacy transport surface.",
  "changedPaths": [
    "tests/test_agent_loop.py",
    "tests/test_browser_playwright.py",
    "tests/test_browser_readonly.py",
    "tests/test_browser_runtime_persistence.py",
    "tests/test_core.py",
    "tests/test_runtime_router.py",
    "tests/test_canonical_result.py",
    "tests/test_delivery_observer.py",
    "tests/test_domain_result_contract.py",
    "tests/test_external_plugin_package.py",
    "tests/test_interactive_provider.py",
    "tests/test_plugin_compatibility.py",
    "tests/test_plugin_conformance.py",
    "tests/test_plugin_distribution.py",
    "tests/test_plugin_lifecycle.py",
    "tests/test_plugin_registry.py",
    "tests/test_plugin_registry_refresh.py",
    "tests/test_plugin_release_gate.py",
    "tests/test_plugin_wheel_assembly.py",
    "tests/test_surface_conformance.py",
    "tests/test_transport.py",
    "design/changes/delete-tests-for-retired-plugin-runtimes.json"
  ],
  "authorityDocuments": ["docs/platform-constitution-v2.md", "docs/platform-plugin-boundary-contract.md", "docs/design-confirmation-contract-v1.md"],
  "ownership": {"platform": ["compiled contract tests"], "plugin": ["declaration-only fixtures"], "provider": ["provider tests"], "agent": ["ReviewBatch tests"]},
  "capabilities": {"inputKinds": ["document", "markdown", "browser_snapshot"], "required": ["compiled_contract_runtime"]},
  "forbiddenResponsibilities": ["tests that require deleted production APIs", "compatibility test doubles for removed runtimes", "wheel plugin release expectations"],
  "publicContractImpact": "breaking",
  "acceptance": ["no deleted test imports a retired module or symbol", "compiled/runtime/provider tests remain", "full discovery no longer fails on these historical modules"],
  "humanApproval": {"required": true, "status": "approved", "approver": "user", "approvedAt": "2026-09-16T00:00:00+08:00", "decision": "Approved by the no-compatibility requirement and instruction to continue cleanup."},
  "state": "verified"
}
